{
  "planVersion": "candidate-authority-field-plan/3.0.0",
  "status": "pre-live-go-pending-independent-rereview",
  "bindings": {
    "catalogVersion": "public-v1",
    "catalogDigest": "4819dd94cb1bbe5e27c31ca5ca55976da1442987a792bf438d96681021cb8634",
    "taxonomyVersion": "1.0.0",
    "taxonomyDigest": "838fa85b2e6937866854b6f733fe7045cf49d5f811cb5e4a8d503bfbd76a61c9",
    "decisionDenominatorVersion": "ranking-decision-denominator/1.0.0",
    "readinessPolicyVersion": "ranking-v1-deterministic-readiness-policy/3.0.0",
    "readinessPolicyDigest": "9460725d84404616b045d2039251a4df28a4bd8ca7c7863487cb88c091899c4c",
    "partialSemanticRegistryVersion": "candidate-authority-partial-field-semantics/1.0.0",
    "partialSemanticRegistryDigest": "effb398b80fb84a88b51bb8f0565e05b6e9c665cb11ed4eda41162ff350db016",
    "partialEvidenceContractVersion": "candidate-authority-partial-field-evidence/2.0.0",
    "partialEvidenceContractDigest": "a4432de831ef9e471d271c82effeaf916c30b6614675237c400d9e8486d60351",
    "historicalFieldPlanVersion": "candidate-authority-field-plan/1.0.0",
    "historicalFieldPlanDigest": "ac643d102cb7e20a711b5c0a59508608e30ad7d0f1b7446d345237c53289607a"
  },
  "frozenGate": {
    "denominatorSize": 18,
    "minimumRealizedReadyFields": 13,
    "exactPercentage": 72.222222,
    "minimumFieldPerBreadthGroup": 1
  },
  "plannedDeterministicExtractionCapableFieldCount": 13,
  "plannedDeterministicFullClosureFieldCount": 6,
  "goDecision": "go-pending-independent-rereview",
  "goDecisionReasons": [
    "Thirteen fields have bounded field-semantic deterministic rules capable of meaningful source-supported output without live coverage.",
    "All four breadth groups contain at least one deterministic extraction path.",
    "The six M3A full-closure candidates remain separately identified and unchanged.",
    "Final readiness remains unmeasured until the one future all-150 authority contains meaningful non-not-applicable deterministic output.",
    "No live authority, provider value, credential, or all-candidate coverage informed this plan."
  ],
  "fields": [
    {
      "fieldId": "adoption-unit-type",
      "posture": "deterministic-partial-path",
      "sourceAuthorityVersion": "candidate-authority-source-policy/3.0.0",
      "extractionRuleVersion": "candidate-authority-adoption-unit/3.0.0",
      "sourceKind": "catalog-package-mapping-and-exact-package-runtime-entry-point",
      "versionScope": "Exact catalog npm mapping and exact published npm version with an explicit exports, main, or module runtime entry point.",
      "positiveFacts": [
        "importable-runtime-package-surface: an exact npm version publishes an explicit importable runtime entry point"
      ],
      "partialFactCodes": ["importable-runtime-package-surface"],
      "negativeAbsenceSemantics": "No package mapping, publication failure, or missing entry-point property proves no package, service, sidecar, or managed adoption form.",
      "unresolvedRemainder": "Other adoption forms and the complete adoption-unit concept set remain unknown.",
      "completenessRequirement": "A complete profile value still requires closure of every applicable adoption concept; this rule supplies only a positive importable-runtime-package surface.",
      "freshnessRequirement": "Mutable registry resolution cutoff and exact immutable package version are retained.",
      "notApplicableRule": "not permitted by the field registry",
      "evidenceTopic": "candidate-adoption-unit-type",
      "evidenceDimension": "integration",
      "evidenceProvenanceKind": "package-version",
      "generationOrigin": "deterministic",
      "canEmitMeaningfulNonUnknownFact": true,
      "incompleteAuthorityOutcome": "explicit-unknown-or-partial",
      "negativeClaimsRequireCompleteSource": true,
      "provenanceAndFieldBindingRetained": true,
      "prohibitedExtractionInputs": [
        "candidate-id-as-fit-fact",
        "model-output",
        "popularity",
        "ranking-v1-evaluation-classification",
        "ranking-v1-gold",
        "scorer-output"
      ],
      "evidenceBridgeWithoutProseInterpretation": true,
      "plannedExtractionCapable": true,
      "deterministicFullClosureCandidate": false,
      "breadthGroup": "capability-adoption",
      "providerOperations": ["npm-package-metadata"],
      "reusesPhase8Rule": false,
      "requiresSuccessorRule": true,
      "rationale": "An explicit exact-version runtime entry point establishes a package adoption surface; publication alone is insufficient and no other adoption form is excluded."
    },
    {
      "fieldId": "capability-variants-features",
      "posture": "human-reviewed-structured-only",
      "sourceAuthorityVersion": "candidate-authority-source-policy/3.0.0",
      "extractionRuleVersion": "candidate-authority-capability-features/2.0.0",
      "sourceKind": "reviewed-taxonomy-assignment",
      "versionScope": "Review must bind exact source revisions and taxonomy digest.",
      "positiveFacts": [],
      "partialFactCodes": [],
      "negativeAbsenceSemantics": "README, descriptions, topics, and missing declarations prove no feature absence.",
      "unresolvedRemainder": "The complete feature set remains unknown without accepted human review.",
      "completenessRequirement": "Every applicable controlled feature must be classified under accepted review.",
      "freshnessRequirement": "Review binds exact source versions.",
      "notApplicableRule": "not permitted by the field registry",
      "evidenceTopic": "candidate-capability-features",
      "evidenceDimension": "capability-family",
      "evidenceProvenanceKind": "approved-validation",
      "generationOrigin": "human-reviewed",
      "canEmitMeaningfulNonUnknownFact": false,
      "incompleteAuthorityOutcome": "explicit-unknown-or-partial",
      "negativeClaimsRequireCompleteSource": true,
      "provenanceAndFieldBindingRetained": true,
      "prohibitedExtractionInputs": [
        "candidate-id-as-fit-fact",
        "model-output",
        "popularity",
        "ranking-v1-evaluation-classification",
        "ranking-v1-gold",
        "scorer-output"
      ],
      "evidenceBridgeWithoutProseInterpretation": true,
      "plannedExtractionCapable": false,
      "deterministicFullClosureCandidate": false,
      "breadthGroup": "capability-adoption",
      "providerOperations": [],
      "reusesPhase8Rule": false,
      "requiresSuccessorRule": false,
      "rationale": "No bounded machine-readable source declares the complete accepted feature vocabulary."
    },
    {
      "fieldId": "language-ecosystem",
      "posture": "deterministic-partial-path",
      "sourceAuthorityVersion": "candidate-authority-source-policy/3.0.0",
      "extractionRuleVersion": "candidate-authority-language-ecosystem/3.0.0",
      "sourceKind": "structured-repository-primary-language",
      "versionScope": "Mutable GitHub repository metadata snapshot at cutoff.",
      "positiveFacts": ["repository-primary-language"],
      "partialFactCodes": ["repository-primary-language"],
      "negativeAbsenceSemantics": "Null, unsupported, or missing repository primary language proves no language or ecosystem absence; npm package ecosystem is not a language fact.",
      "unresolvedRemainder": "Additional implementation and consumer ecosystems remain unknown.",
      "completenessRequirement": "Complete profile value requires all applicable language ecosystems.",
      "freshnessRequirement": "Repository metadata collectedAt/effectiveAsOf and mutable-source limitation are retained.",
      "notApplicableRule": "not permitted by the field registry",
      "evidenceTopic": "candidate-language-ecosystem",
      "evidenceDimension": "runtime-framework",
      "evidenceProvenanceKind": "structured-provider-snapshot",
      "generationOrigin": "deterministic",
      "canEmitMeaningfulNonUnknownFact": true,
      "incompleteAuthorityOutcome": "explicit-unknown-or-partial",
      "negativeClaimsRequireCompleteSource": true,
      "provenanceAndFieldBindingRetained": true,
      "prohibitedExtractionInputs": [
        "candidate-id-as-fit-fact",
        "model-output",
        "popularity",
        "ranking-v1-evaluation-classification",
        "ranking-v1-gold",
        "scorer-output"
      ],
      "evidenceBridgeWithoutProseInterpretation": true,
      "plannedExtractionCapable": true,
      "deterministicFullClosureCandidate": false,
      "breadthGroup": "stack-package",
      "providerOperations": ["github-repository-metadata"],
      "reusesPhase8Rule": false,
      "requiresSuccessorRule": true,
      "rationale": "The accepted primary-language mapping establishes one repository language/ecosystem fact; it does not close the repository or consumer language set."
    },
    {
      "fieldId": "package-publication-version",
      "posture": "deterministic-complete-path",
      "sourceAuthorityVersion": "profile-materialization-provider-policy/1.0.0",
      "extractionRuleVersion": "profile-materialization-package-publication/1.0.0",
      "sourceKind": "structured-package-registry",
      "versionScope": "Exact latest npm version selected at cutoff.",
      "positiveFacts": ["exact published package version and publication time"],
      "partialFactCodes": [],
      "negativeAbsenceSemantics": "Mapped absence or incomplete metadata is unknown; catalog-unmapped is legal deterministic not-applicable.",
      "unresolvedRemainder": "None when mapped authority is complete or catalog-unmapped is proved.",
      "completenessRequirement": "Exact identity, latest version object, and publish time close mapped candidates.",
      "freshnessRequirement": "Registry cutoff and exact immutable version are retained.",
      "notApplicableRule": "catalog npm-package is null",
      "evidenceTopic": "candidate-package-publication-version",
      "evidenceDimension": "version-release",
      "evidenceProvenanceKind": "package-version",